{
  "$schema": "https://opencode.ai/schemas/test-activity-rules.json",
  "version": 1,
  "defaults": {
    "e2e": "deferred",
    "unit": true
  },
  "filePatterns": {
    "**/auth/**": {
      "critics": ["security-critic", "exploit-critic"],
      "e2e": "immediate",
      "unit": true,
      "reason": "Auth code is security-critical — immediate E2E"
    },
    "**/payment/**": {
      "critics": ["security-critic", "exploit-critic", "backend-critic-ts"],
      "e2e": "immediate",
      "quality": true,
      "unit": true,
      "reason": "Payment code is security-critical — immediate E2E"
    },
    "**/billing/**": {
      "critics": ["security-critic", "exploit-critic", "backend-critic-ts"],
      "e2e": "immediate",
      "quality": true,
      "unit": true,
      "reason": "Billing code is security-critical — immediate E2E"
    },
    "**/checkout/**": {
      "critics": ["security-critic", "backend-critic-ts"],
      "e2e": "immediate",
      "quality": true,
      "unit": true,
      "reason": "Checkout flow is critical path — immediate E2E"
    },
    "**/*.tsx": {
      "critics": ["frontend-critic"],
      "unit": "react-tester",
      "e2e": "deferred",
      "quality": ["aesthetic-critic"],
      "reason": "React components — unit test + deferred E2E"
    },
    "**/*.jsx": {
      "critics": ["frontend-critic"],
      "unit": "react-tester",
      "e2e": "deferred",
      "quality": ["aesthetic-critic"],
      "reason": "React components — unit test + deferred E2E"
    },
    "**/pages/**": {
      "e2e": "deferred",
      "quality": ["aesthetic-critic"],
      "reason": "Page components — deferred E2E"
    },
    "**/app/**/*.tsx": {
      "e2e": "deferred",
      "quality": ["aesthetic-critic"],
      "reason": "App router pages — deferred E2E"
    },
    "**/components/**": {
      "e2e": "deferred",
      "e2eScope": "dependents",
      "quality": ["aesthetic-critic"],
      "reason": "Components — test pages that use them"
    },
    "**/api/**": {
      "critics": ["api-critic", "backend-critic-ts"],
      "e2e": "immediate",
      "unit": true,
      "reason": "API routes affect user flows — immediate E2E"
    },
    "**/routes/**": {
      "critics": ["api-critic", "backend-critic-ts"],
      "e2e": "immediate",
      "unit": true,
      "reason": "API routes affect user flows — immediate E2E"
    },
    "**/middleware/**": {
      "critics": ["security-critic", "network-critic"],
      "e2e": "immediate",
      "unit": true,
      "reason": "Middleware affects all requests — immediate E2E"
    },
    "**/cors.ts": {
      "critics": ["security-critic", "backend-critic-ts"],
      "e2e": "immediate",
      "unit": true,
      "reason": "CORS configuration affects browser security — requires browser verification (curl won't catch CORS issues)"
    },
    "**/cors.js": {
      "critics": ["security-critic", "backend-critic-ts"],
      "e2e": "immediate",
      "unit": true,
      "reason": "CORS configuration affects browser security — requires browser verification (curl won't catch CORS issues)"
    },
    "**/*cors*.ts": {
      "critics": ["security-critic"],
      "e2e": "immediate",
      "reason": "CORS-related files affect browser security — requires browser verification"
    },
    "**/*cors*.js": {
      "critics": ["security-critic"],
      "e2e": "immediate",
      "reason": "CORS-related files affect browser security — requires browser verification"
    },
    "**/headers.ts": {
      "critics": ["security-critic", "network-critic"],
      "e2e": "immediate",
      "unit": true,
      "reason": "HTTP headers configuration affects browser behavior — immediate E2E"
    },
    "**/headers.js": {
      "critics": ["security-critic", "network-critic"],
      "e2e": "immediate",
      "unit": true,
      "reason": "HTTP headers configuration affects browser behavior — immediate E2E"
    },
    "**/security*.ts": {
      "critics": ["security-critic", "exploit-critic"],
      "e2e": "immediate",
      "unit": true,
      "reason": "Security configuration — immediate E2E"
    },
    "**/security*.js": {
      "critics": ["security-critic", "exploit-critic"],
      "e2e": "immediate",
      "unit": true,
      "reason": "Security configuration — immediate E2E"
    },
    "**/middleware.ts": {
      "critics": ["security-critic", "network-critic"],
      "e2e": "immediate",
      "unit": true,
      "reason": "Next.js middleware affects all requests — immediate E2E"
    },
    "**/*.md": {
      "critics": [],
      "unit": false,
      "e2e": "skip",
      "reason": "Documentation — no runtime impact"
    },
    "**/README*": {
      "critics": [],
      "unit": false,
      "e2e": "skip",
      "reason": "Documentation — no runtime impact"
    },
    "**/*.d.ts": {
      "critics": [],
      "unit": false,
      "e2e": "skip",
      "reason": "Type definitions — compile-time only"
    },
    "**/types.ts": {
      "critics": [],
      "unit": false,
      "e2e": "skip",
      "reason": "Type definitions — compile-time only (verify no runtime exports)"
    },
    "**/types/*.ts": {
      "critics": [],
      "unit": false,
      "e2e": "skip",
      "reason": "Type definitions — compile-time only"
    },
    "**/*.test.ts": {
      "critics": [],
      "unit": false,
      "e2e": "skip",
      "reason": "Test files — tests test themselves"
    },
    "**/*.test.tsx": {
      "critics": [],
      "unit": false,
      "e2e": "skip",
      "reason": "Test files — tests test themselves"
    },
    "**/*.spec.ts": {
      "critics": [],
      "unit": false,
      "e2e": "skip",
      "reason": "Test files — tests test themselves"
    },
    "**/*.spec.tsx": {
      "critics": [],
      "unit": false,
      "e2e": "skip",
      "reason": "Test files — tests test themselves"
    },
    "**/__tests__/**": {
      "critics": [],
      "unit": false,
      "e2e": "skip",
      "reason": "Test files — tests test themselves"
    },
    "**/e2e/**": {
      "critics": [],
      "unit": false,
      "e2e": "skip",
      "reason": "E2E test files — tests test themselves"
    },
    "**/.eslintrc*": {
      "critics": [],
      "unit": false,
      "e2e": "skip",
      "reason": "Dev tooling config — no runtime impact"
    },
    "**/eslint.config.*": {
      "critics": [],
      "unit": false,
      "e2e": "skip",
      "reason": "Dev tooling config — no runtime impact"
    },
    "**/.prettierrc*": {
      "critics": [],
      "unit": false,
      "e2e": "skip",
      "reason": "Dev tooling config — no runtime impact"
    },
    "**/prettier.config.*": {
      "critics": [],
      "unit": false,
      "e2e": "skip",
      "reason": "Dev tooling config — no runtime impact"
    },
    "**/tsconfig*.json": {
      "critics": [],
      "unit": false,
      "e2e": "skip",
      "reason": "TypeScript config — no runtime impact"
    },
    "**/jsconfig*.json": {
      "critics": [],
      "unit": false,
      "e2e": "skip",
      "reason": "JavaScript config — no runtime impact"
    },
    "**/.gitignore": {
      "critics": [],
      "unit": false,
      "e2e": "skip",
      "reason": "Git config — no runtime impact"
    },
    "**/.github/**": {
      "critics": [],
      "unit": false,
      "e2e": "skip",
      "reason": "CI/CD config — no runtime impact"
    },
    "**/jest.config.*": {
      "critics": [],
      "unit": false,
      "e2e": "skip",
      "reason": "Test config — no runtime impact"
    },
    "**/vitest.config.*": {
      "critics": [],
      "unit": false,
      "e2e": "skip",
      "reason": "Test config — no runtime impact"
    },
    "**/playwright.config.*": {
      "critics": [],
      "unit": false,
      "e2e": "skip",
      "reason": "E2E config — no runtime impact"
    },
    "**/utils/**": {
      "critics": [],
      "unit": true,
      "e2e": "deferred",
      "e2eScope": "dependents",
      "reason": "Utils affect runtime — smoke test dependents"
    },
    "**/lib/**": {
      "critics": [],
      "unit": true,
      "e2e": "deferred",
      "e2eScope": "dependents",
      "reason": "Lib code affects runtime — smoke test dependents"
    },
    "**/helpers/**": {
      "critics": [],
      "unit": true,
      "e2e": "deferred",
      "e2eScope": "dependents",
      "reason": "Helper code affects runtime — smoke test dependents"
    },
    "**/hooks/**": {
      "critics": ["frontend-critic"],
      "unit": "react-tester",
      "e2e": "deferred",
      "e2eScope": "dependents",
      "reason": "Hooks affect components — smoke test dependents"
    },
    "**/services/**": {
      "critics": ["backend-critic-ts", "network-critic"],
      "unit": true,
      "e2e": "immediate",
      "reason": "Services are core business logic — immediate E2E"
    },
    "**/db/**": {
      "critics": ["backend-critic-ts"],
      "unit": true,
      "e2e": "immediate",
      "reason": "Database code affects data — immediate E2E"
    },
    "**/database/**": {
      "critics": ["backend-critic-ts"],
      "unit": true,
      "e2e": "immediate",
      "reason": "Database code affects data — immediate E2E"
    },
    "**/prisma/**": {
      "critics": ["backend-critic-ts"],
      "e2e": "immediate",
      "reason": "Prisma changes affect data layer — immediate E2E"
    },
    "**/schema.prisma": {
      "e2e": "immediate",
      "reason": "Schema changes affect all data access — immediate E2E"
    },
    "**/drizzle/**": {
      "critics": ["backend-critic-ts"],
      "e2e": "immediate",
      "reason": "Drizzle changes affect data layer — immediate E2E"
    },
    "**/migrations/**": {
      "critics": ["backend-critic-ts"],
      "e2e": "immediate",
      "reason": "Migrations affect data — immediate E2E"
    },
    "**/*.css": {
      "e2e": "deferred",
      "quality": ["aesthetic-critic", "tailwind-critic"],
      "reason": "Styling changes — visual check at E2E"
    },
    "**/*.scss": {
      "e2e": "deferred",
      "quality": ["aesthetic-critic"],